Ether / IP / TCP 192.168.1.19:502 > 192.168.1.23:49173 PA / Raw
[ Target : Ether / IP / TCP 192.168.1.19:502 > 192.168.1.23:49173 PA / Raw ]
Ether / IP / TCP 192.168.1.19:502 > 192.168.1.23:49173 A / Padding
Ether / IP / TCP 192.168.1.19:502 > 192.168.1.23:49173 PA / Raw
Ether / IP / TCP 192.168.1.19:502 > 192.168.1.23:49173 PA / Raw
Ether / IP / TCP 192.168.1.19:502 > 192.168.1.23:49173 A / Padding
Ether / IP / TCP 192.168.1.19:502 > 192.168.1.23:49173 PA / Raw
[ Target : Ether / IP / TCP 192.168.1.19:502 > 192.168.1.23:49173 PA / Raw ]
Ether / IP / TCP 192.168.1.19:502 > 192.168.1.23:49173 PA / Raw
Ether / IP / TCP 192.168.1.19:502 > 192.168.1.23:49173 A / Padding
Ether / IP / TCP 192.168.1.19:502 > 192.168.1.23:49173 PA / Raw
Ether / IP / TCP 192.168.1.19:502 > 192.168.1.23:49173 PA / Raw
[ Target : Ether / IP / TCP 192.168.1.19:502 > 192.168.1.23:49173 PA / Raw ]
Ether / IP / TCP 192.168.1.19:502 > 192.168.1.23:49173 A / Padding
Ether / IP / TCP 192.168.1.19:502 > 192.168.1.23:49173 PA / Raw
Ether / IP / TCP 192.168.1.19:502 > 192.168.1.23:49173 PA / Raw
Ether / IP / TCP 192.168.1.19:502 > 192.168.1.23:49173 A / Padding
Ether / IP / TCP 192.168.1.19:502 > 192.168.1.23:49173 PA / Raw
[ Target : Ether / IP / TCP 192.168.1.19:502 > 192.168.1.23:49173 PA / Raw ]
Ether / IP / TCP 192.168.1.19:502 > 192.168.1.23:49173 PA / Raw
Ether / IP / TCP 192.168.1.19:502 > 192.168.1.23:49173 A / Padding
Ether / IP / TCP 192.168.1.19:502 > 192.168.1.23:49173 PA / Raw
Ether / IP / TCP 192.168.1.19:502 > 192.168.1.23:49173 PA / Raw
[ Target : Ether / IP / TCP 192.168.1.19:502 > 192.168.1.23:49173 PA / Raw ]
Ether / IP / TCP 192.168.1.19:502 > 192.168.1.23:49173 A / Padding
Ether / IP / TCP 192.168.1.19:502 > 192.168.1.23:49173 PA / Raw
Ether / IP / TCP 192.168.1.19:502 > 192.168.1.23:49173 PA / Raw
Ether / IP / TCP 192.168.1.19:502 > 192.168.1.23:49173 A / Padding
Ether / IP / TCP 192.168.1.19:502 > 192.168.1.23:49173 PA / Raw
[ Target : Ether / IP / TCP 192.168.1.19:502 > 192.168.1.23:49173 PA / Raw ]
Ether / IP / TCP 192.168.1.19:502 > 192.168.1.23:49173 PA / Raw
Ether / IP / TCP 192.168.1.19:502 > 192.168.1.23:49173 A / Padding
Ether / IP / TCP 192.168.1.19:502 > 192.168.1.23:49173 PA / Raw
Ether / IP / TCP 192.168.1.19:502 > 192.168.1.23:49173 PA / Raw
[ Target : Ether / IP / TCP 192.168.1.19:502 > 192.168.1.23:49173 PA / Raw ]
Ether / IP / TCP 192.168.1.19:502 > 192.168.1.23:49173 A / Padding
Ether / IP / TCP 192.168.1.19:502 > 192.168.1.23:49173 PA / Raw
Ether / IP / TCP 192.168.1.19:502 > 192.168.1.23:49173 PA / Raw
Ether / IP / TCP 192.168.1.19:502 > 192.168.1.23:49173 A / Padding
Ether / IP / TCP 192.168.1.19:502 > 192.168.1.23:49173 PA / Raw
[ Target : Ether / IP / TCP 192.168.1.19:502 > 192.168.1.23:49173 PA / Raw ]
Ether / IP / TCP 192.168.1.19:502 > 192.168.1.23:49173 PA / Raw
Ether / IP / TCP 192.168.1.19:502 > 192.168.1.23:49173 A / Padding
Ether / IP / TCP 192.168.1.19:502 > 192.168.1.23:49173 PA / Raw
Ether / IP / TCP 192.168.1.19:502 > 192.168.1.23:49173 PA / Raw
[ Target : Ether / IP / TCP 192.168.1.19:502 > 192.168.1.23:49173 PA / Raw ]
Ether / IP / TCP 192.168.1.19:502 > 192.168.1.23:49173 A / Padding
Ether / IP / TCP 192.168.1.19:502 > 192.168.1.23:49173 PA / Raw
Ether / IP / TCP 192.168.1.19:502 > 192.168.1.23:49173 PA / Raw
Ether / IP / TCP 192.168.1.19:502 > 192.168.1.23:49173 A / Padding
Ether / IP / TCP 192.168.1.19:502 > 192.168.1.23:49173 PA / Raw
[ Target : Ether / IP / TCP 192.168.1.19:502 > 192.168.1.23:49173 PA / Raw ]
Ether / IP / TCP 192.168.1.19:502 > 192.168.1.23:49173 PA / Raw
Ether / IP / TCP 192.168.1.19:502 > 192.168.1.23:49173 A / Padding
Ether / IP / TCP 192.168.1.19:502 > 192.168.1.23:49173 PA / Raw
Ether / IP / TCP 192.168.1.19:502 > 192.168.1.23:49173 PA / Raw
[ Target : Ether / IP / TCP 192.168.1.19:502 > 192.168.1.23:49173 PA / Raw ]
Ether / IP / TCP 192.168.1.19:502 > 192.168.1.23:49173 A / Padding
Ether / IP / TCP 192.168.1.19:502 > 192.168.1.23:49173 PA / Raw
Ether / IP / TCP 192.168.1.19:502 > 192.168.1.23:49173 PA / Raw
Ether / IP / TCP 192.168.1.19:502 > 192.168.1.23:49173 A / Padding
Ether / IP / TCP 192.168.1.19:502 > 192.168.1.23:49173 PA / Raw
[ Target : Ether / IP / TCP 192.168.1.19:502 > 192.168.1.23:49173 PA / Raw ]
Ether / IP / TCP 192.168.1.19:502 > 192.168.1.23:49173 PA / Raw
Ether / IP / TCP 192.168.1.19:502 > 192.168.1.23:49173 A / Padding
Ether / IP / TCP 192.168.1.19:502 > 192.168.1.23:49173 PA / Raw
Ether / IP / TCP 192.168.1.19:502 > 192.168.1.23:49173 PA / Raw
[ Target : Ether / IP / TCP 192.168.1.19:502 > 192.168.1.23:49173 PA / Raw ]
Ether / IP / TCP 192.168.1.19:502 > 192.168.1.23:49173 A / Padding
Ether / IP / TCP 192.168.1.19:502 > 192.168.1.23:49173 PA / Raw
Ether / IP / TCP 192.168.1.19:502 > 192.168.1.23:49173 PA / Raw
Ether / IP / TCP 192.168.1.19:502 > 192.168.1.23:49173 A / Padding
Ether / IP / TCP 192.168.1.19:502 > 192.168.1.23:49173 PA / Raw
[ Target : Ether / IP / TCP 192.168.1.19:502 > 192.168.1.23:49173 PA / Raw ]
Ether / IP / TCP 192.168.1.19:502 > 192.168.1.23:49173 PA / Raw
Ether / IP / TCP 192.168.1.19:502 > 192.168.1.23:49173 A / Padding
Ether / IP / TCP 192.168.1.19:502 > 192.168.1.23:49173 PA / Raw
Ether / IP / TCP 192.168.1.19:502 > 192.168.1.23:49173 PA / Raw
[ Target : Ether / IP / TCP 192.168.1.19:502 > 192.168.1.23:49173 PA / Raw ]
Ether / IP / TCP 192.168.1.19:502 > 192.168.1.23:49173 A / Padding
Ether / IP / TCP 192.168.1.19:502 > 192.168.1.23:49173 PA / Raw
Ether / IP / TCP 192.168.1.19:502 > 192.168.1.23:49173 PA / Raw
Ether / IP / TCP 192.168.1.19:502 > 192.168.1.23:49173 A / Padding
Ether / IP / TCP 192.168.1.19:502 > 192.168.1.23:49173 PA / Raw
[ Target : Ether / IP / TCP 192.168.1.19:502 > 192.168.1.23:49173 PA / Raw ]
Ether / IP / TCP 192.168.1.19:502 > 192.168.1.23:49173 PA / Raw
Ether / IP / TCP 192.168.1.19:502 > 192.168.1.23:49173 A / Padding
Ether / IP / TCP 192.168.1.19:502 > 192.168.1.23:49173 PA / Raw
Ether / IP / TCP 192.168.1.19:502 > 192.168.1.23:49173 PA / Raw
[ Target : Ether / IP / TCP 192.168.1.19:502 > 192.168.1.23:49173 PA / Raw ]
Ether / IP / TCP 192.168.1.19:502 > 192.168.1.23:49173 A / Padding
Ether / IP / TCP 192.168.1.19:502 > 192.168.1.23:49173 PA / Raw
Ether / IP / TCP 192.168.1.19:502 > 192.168.1.23:49173 PA / Raw
Ether / IP / TCP 192.168.1.19:502 > 192.168.1.23:49173 A / Padding
Ether / IP / TCP 192.168.1.19:502 > 192.168.1.23:49173 PA / Raw
[ Target : Ether / IP / TCP 192.168.1.19:502 > 192.168.1.23:49173 PA / Raw ]
Ether / IP / TCP 192.168.1.19:502 > 192.168.1.23:49173 PA / Raw
Ether / IP / TCP 192.168.1.19:502 > 192.168.1.23:49173 A / Padding
Ether / IP / TCP 192.168.1.19:502 > 192.168.1.23:49173 PA / Raw
Ether / IP / TCP 192.168.1.19:502 > 192.168.1.23:49173 PA / Raw
[ Target : Ether / IP / TCP 192.168.1.19:502 > 192.168.1.23:49173 PA / Raw ]
Ether / IP / TCP 192.168.1.19:502 > 192.168.1.23:49173 A / Padding
Ether / IP / TCP 192.168.1.19:502 > 192.168.1.23:49173 PA / Raw
Ether / IP / TCP 192.168.1.19:502 > 192.168.1.23:49173 PA / Raw
Ether / IP / TCP 192.168.1.19:502 > 192.168.1.23:49173 A / Padding
Ether / IP / TCP 192.168.1.19:502 > 192.168.1.23:49173 PA / Raw
[ Target : Ether / IP / TCP 192.168.1.19:502 > 192.168.1.23:49173 PA / Raw ]
Ether / IP / TCP 192.168.1.19:502 > 192.168.1.23:49173 PA / Raw
Ether / IP / TCP 192.168.1.19:502 > 192.168.1.23:49173 A / Padding
Ether / IP / TCP 192.168.1.19:502 > 192.168.1.23:49173 PA / Raw
Ether / IP / TCP 192.168.1.19:502 > 192.168.1.23:49173 PA / Raw
[ Target : Ether / IP / TCP 192.168.1.19:502 > 192.168.1.23:49173 PA / Raw ]
Ether / IP / TCP 192.168.1.19:502 > 192.168.1.23:49173 A / Padding
Ether / IP / TCP 192.168.1.19:502 > 192.168.1.23:49173 PA / Raw
Ether / IP / TCP 192.168.1.19:502 > 192.168.1.23:49173 PA / Raw
Ether / IP / TCP 192.168.1.19:502 > 192.168.1.23:49173 A / Padding
Ether / IP / TCP 192.168.1.19:502 > 192.168.1.23:49173 PA / Raw
Ether / IP / TCP 192.168.1.19:502 > 192.168.1.23:49173 PA / Raw
[ Target : Ether / IP / TCP 192.168.1.19:502 > 192.168.1.23:49173 PA / Raw ]
Ether / IP / TCP 192.168.1.19:502 > 192.168.1.23:49173 A / Padding
Ether / IP / TCP 192.168.1.19:502 > 192.168.1.23:49173 PA / Raw
Ether / IP / TCP 192.168.1.19:502 > 192.168.1.23:49173 PA / Raw
Ether / IP / TCP 192.168.1.19:502 > 192.168.1.23:49173 A / Padding
Ether / IP / TCP 192.168.1.19:502 > 192.168.1.23:49173 PA / Raw
[ Target : Ether / IP / TCP 192.168.1.19:502 > 192.168.1.23:49173 PA / Raw ]
Ether / IP / TCP 192.168.1.19:502 > 192.168.1.23:49173 PA / Raw
Ether / IP / TCP 192.168.1.19:502 > 192.168.1.23:49173 A / Padding
Ether / IP / TCP 192.168.1.19:502 > 192.168.1.23:49173 PA / Raw
Ether / IP / TCP 192.168.1.19:502 > 192.168.1.23:49173 PA / Raw
[ Target : Ether / IP / TCP 192.168.1.19:502 > 192.168.1.23:49173 PA / Raw ]
Ether / IP / TCP 192.168.1.19:502 > 192.168.1.23:49173 A / Padding
Ether / IP / TCP 192.168.1.19:502 > 192.168.1.23:49173 PA / Raw
Ether / IP / TCP 192.168.1.19:502 > 192.168.1.23:49173 PA / Raw
Ether / IP / TCP 192.168.1.19:502 > 192.168.1.23:49173 A / Padding
Ether / IP / TCP 192.168.1.19:502 > 192.168.1.23:49173 PA / Raw
[ Target : Ether / IP / TCP 192.168.1.19:502 > 192.168.1.23:49173 PA / Raw ]
Ether / IP / TCP 192.168.1.19:502 > 192.168.1.23:49173 PA / Raw
Ether / IP / TCP 192.168.1.19:502 > 192.168.1.23:49173 A / Padding
Ether / IP / TCP 192.168.1.19:502 > 192.168.1.23:49173 PA / Raw
Ether / IP / TCP 192.168.1.19:502 > 192.168.1.23:49173 PA / Raw
[ Target : Ether / IP / TCP 192.168.1.19:502 > 192.168.1.23:49173 PA / Raw ]
Ether / IP / TCP 192.168.1.19:502 > 192.168.1.23:49173 A / Padding
Ether / IP / TCP 192.168.1.19:502 > 192.168.1.23:49173 PA / Raw
Ether / IP / TCP 192.168.1.19:502 > 192.168.1.23:49173 PA / Raw
Ether / IP / TCP 192.168.1.19:502 > 192.168.1.23:49173 A / Padding
Ether / IP / TCP 192.168.1.19:502 > 192.168.1.23:49173 PA / Raw
[ Target : Ether / IP / TCP 192.168.1.19:502 > 192.168.1.23:49173 PA / Raw ]
Ether / IP / TCP 192.168.1.19:502 > 192.168.1.23:49173 PA / Raw
Ether / IP / TCP 192.168.1.19:502 > 192.168.1.23:49173 A / Padding
Ether / IP / TCP 192.168.1.19:502 > 192.168.1.23:49173 PA / Raw
Ether / IP / TCP 192.168.1.19:502 > 192.168.1.23:49173 PA / Raw
[ Target : Ether / IP / TCP 192.168.1.19:502 > 192.168.1.23:49173 PA / Raw ]
Ether / IP / TCP 192.168.1.19:502 > 192.168.1.23:49173 A / Padding
Ether / IP / TCP 192.168.1.19:502 > 192.168.1.23:49173 PA / Raw
Ether / IP / TCP 192.168.1.19:502 > 192.168.1.23:49173 PA / Raw
Ether / IP / TCP 192.168.1.19:502 > 192.168.1.23:49173 A / Padding
Ether / IP / TCP 192.168.1.19:502 > 192.168.1.23:49173 PA / Raw
[ Target : Ether / IP / TCP 192.168.1.19:502 > 192.168.1.23:49173 PA / Raw ]
Ether / IP / TCP 192.168.1.19:502 > 192.168.1.23:49173 PA / Raw
Ether / IP / TCP 192.168.1.19:502 > 192.168.1.23:49173 A / Padding
Ether / IP / TCP 192.168.1.19:502 > 192.168.1.23:49173 PA / Raw
Ether / IP / TCP 192.168.1.19:502 > 192.168.1.23:49173 PA / Raw
[ Target : Ether / IP / TCP 192.168.1.19:502 > 192.168.1.23:49173 PA / Raw ]
Ether / IP / TCP 192.168.1.19:502 > 192.168.1.23:49173 A / Padding
Ether / IP / TCP 192.168.1.19:502 > 192.168.1.23:49173 PA / Raw
Ether / IP / TCP 192.168.1.19:502 > 192.168.1.23:49173 PA / Raw
Ether / IP / TCP 192.168.1.19:502 > 192.168.1.23:49173 A / Padding
Ether / IP / TCP 192.168.1.19:502 > 192.168.1.23:49173 PA / Raw
[ Target : Ether / IP / TCP 192.168.1.19:502 > 192.168.1.23:49173 PA / Raw ]
Ether / IP / TCP 192.168.1.19:502 > 192.168.1.23:49173 PA / Raw
Ether / IP / TCP 192.168.1.19:502 > 192.168.1.23:49173 A / Padding
Ether / IP / TCP 192.168.1.19:502 > 192.168.1.23:49173 PA / Raw
Ether / IP / TCP 192.168.1.19:502 > 192.168.1.23:49173 PA / Raw
[ Target : Ether / IP / TCP 192.168.1.19:502 > 192.168.1.23:49173 PA / Raw ]
Ether / IP / TCP 192.168.1.19:502 > 192.168.1.23:49173 A / Padding
Ether / IP / TCP 192.168.1.19:502 > 192.168.1.23:49173 PA / Raw
Ether / IP / TCP 192.168.1.19:502 > 192.168.1.23:49173 PA / Raw
Ether / IP / TCP 192.168.1.19:502 > 192.168.1.23:49173 A / Padding
Ether / IP / TCP 192.168.1.19:502 > 192.168.1.23:49173 PA / Raw
[ Target : Ether / IP / TCP 192.168.1.19:502 > 192.168.1.23:49173 PA / Raw ]
Ether / IP / TCP 192.168.1.19:502 > 192.168.1.23:49173 PA / Raw
Ether / IP / TCP 192.168.1.19:502 > 192.168.1.23:49173 A / Padding
Ether / IP / TCP 192.168.1.19:502 > 192.168.1.23:49173 PA / Raw
Ether / IP / TCP 192.168.1.19:502 > 192.168.1.23:49173 PA / Raw
[ Target : Ether / IP / TCP 192.168.1.19:502 > 192.168.1.23:49173 PA / Raw ]
Ether / IP / TCP 192.168.1.19:502 > 192.168.1.23:49173 A / Padding
Ether / IP / TCP 192.168.1.19:502 > 192.168.1.23:49173 PA / Raw
Ether / IP / TCP 192.168.1.19:502 > 192.168.1.23:49173 PA / Raw
Ether / IP / TCP 192.168.1.19:502 > 192.168.1.23:49173 A / Padding
Ether / IP / TCP 192.168.1.19:502 > 192.168.1.23:49173 PA / Raw
[ Target : Ether / IP / TCP 192.168.1.19:502 > 192.168.1.23:49173 PA / Raw ]
Ether / IP / TCP 192.168.1.19:502 > 192.168.1.23:49173 PA / Raw
Ether / IP / TCP 192.168.1.19:502 > 192.168.1.23:49173 A / Padding
Ether / IP / TCP 192.168.1.19:502 > 192.168.1.23:49173 PA / Raw
Ether / IP / TCP 192.168.1.19:502 > 192.168.1.23:49173 PA / Raw
[ Target : Ether / IP / TCP 192.168.1.19:502 > 192.168.1.23:49173 PA / Raw ]
Ether / IP / TCP 192.168.1.19:502 > 192.168.1.23:49173 A / Padding
Ether / IP / TCP 192.168.1.19:502 > 192.168.1.23:49173 PA / Raw
Ether / IP / TCP 192.168.1.19:502 > 192.168.1.23:49173 PA / Raw
Ether / IP / TCP 192.168.1.19:502 > 192.168.1.23:49173 A / Padding
Ether / IP / TCP 192.168.1.19:502 > 192.168.1.23:49173 PA / Raw
[ Target : Ether / IP / TCP 192.168.1.19:502 > 192.168.1.23:49173 PA / Raw ]
Ether / IP / TCP 192.168.1.19:502 > 192.168.1.23:49173 PA / Raw
Ether / IP / TCP 192.168.1.19:502 > 192.168.1.23:49173 A / Padding
Ether / IP / TCP 192.168.1.19:502 > 192.168.1.23:49173 PA / Raw
Ether / IP / TCP 192.168.1.19:502 > 192.168.1.23:49173 PA / Raw
[ Target : Ether / IP / TCP 192.168.1.19:502 > 192.168.1.23:49173 PA / Raw ]
Ether / IP / TCP 192.168.1.19:502 > 192.168.1.23:49173 A / Padding
Ether / IP / TCP 192.168.1.19:502 > 192.168.1.23:49173 PA / Raw
Ether / IP / TCP 192.168.1.19:502 > 192.168.1.23:49173 PA / Raw
Ether / IP / TCP 192.168.1.19:502 > 192.168.1.23:49173 A / Padding
Ether / IP / TCP 192.168.1.19:502 > 192.168.1.23:49173 PA / Raw
[ Target : Ether / IP / TCP 192.168.1.19:502 > 192.168.1.23:49173 PA / Raw ]
Ether / IP / TCP 192.168.1.19:502 > 192.168.1.23:49173 PA / Raw
Ether / IP / TCP 192.168.1.19:502 > 192.168.1.23:49173 A / Padding
Ether / IP / TCP 192.168.1.19:502 > 192.168.1.23:49173 PA / Raw
Ether / IP / TCP 192.168.1.19:502 > 192.168.1.23:49173 PA / Raw
[ Target : Ether / IP / TCP 192.168.1.19:502 > 192.168.1.23:49173 PA / Raw ]
Ether / IP / TCP 192.168.1.19:502 > 192.168.1.23:49173 A / Padding
Ether / IP / TCP 192.168.1.19:502 > 192.168.1.23:49173 PA / Raw
Ether / IP / TCP 192.168.1.19:502 > 192.168.1.23:49173 PA / Raw
Ether / IP / TCP 192.168.1.19:502 > 192.168.1.23:49173 A / Padding
Ether / IP / TCP 192.168.1.19:502 > 192.168.1.23:49173 PA / Raw
[ Target : Ether / IP / TCP 192.168.1.19:502 > 192.168.1.23:49173 PA / Raw ]
Ether / IP / TCP 192.168.1.19:502 > 192.168.1.23:49173 PA / Raw
Ether / IP / TCP 192.168.1.19:502 > 192.168.1.23:49173 A / Padding
Ether / IP / TCP 192.168.1.19:502 > 192.168.1.23:49173 PA / Raw
Ether / IP / TCP 192.168.1.19:502 > 192.168.1.23:49173 PA / Raw
[ Target : Ether / IP / TCP 192.168.1.19:502 > 192.168.1.23:49173 PA / Raw ]
Ether / IP / TCP 192.168.1.19:502 > 192.168.1.23:49173 A / Padding
Ether / IP / TCP 192.168.1.19:502 > 192.168.1.23:49173 PA / Raw
Ether / IP / TCP 192.168.1.19:502 > 192.168.1.23:49173 PA / Raw
Ether / IP / TCP 192.168.1.19:502 > 192.168.1.23:49173 A / Padding
Ether / IP / TCP 192.168.1.19:502 > 192.168.1.23:49173 PA / Raw
[ Target : Ether / IP / TCP 192.168.1.19:502 > 192.168.1.23:49173 PA / Raw ]
Ether / IP / TCP 192.168.1.19:502 > 192.168.1.23:49173 PA / Raw
Ether / IP / TCP 192.168.1.19:502 > 192.168.1.23:49173 A / Padding
Ether / IP / TCP 192.168.1.19:502 > 192.168.1.23:49173 PA / Raw
Ether / IP / TCP 192.168.1.19:502 > 192.168.1.23:49173 PA / Raw
[ Target : Ether / IP / TCP 192.168.1.19:502 > 192.168.1.23:49173 PA / Raw ]
Ether / IP / TCP 192.168.1.19:502 > 192.168.1.23:49173 A / Padding
Ether / IP / TCP 192.168.1.19:502 > 192.168.1.23:49173 PA / Raw
Ether / IP / TCP 192.168.1.19:502 > 192.168.1.23:49173 PA / Raw
Ether / IP / TCP 192.168.1.19:502 > 192.168.1.23:49173 A / Padding
Ether / IP / TCP 192.168.1.19:502 > 192.168.1.23:49173 PA / Raw
[ Target : Ether / IP / TCP 192.168.1.19:502 > 192.168.1.23:49173 PA / Raw ]
Ether / IP / TCP 192.168.1.19:502 > 192.168.1.23:49173 PA / Raw
Ether / IP / TCP 192.168.1.19:502 > 192.168.1.23:49173 A / Padding
Ether / IP / TCP 192.168.1.19:502 > 192.168.1.23:49173 PA / Raw
Ether / IP / TCP 192.168.1.19:502 > 192.168.1.23:49173 PA / Raw
[ Target : Ether / IP / TCP 192.168.1.19:502 > 192.168.1.23:49173 PA / Raw ]
Ether / IP / TCP 192.168.1.19:502 > 192.168.1.23:49173 A / Padding
Ether / IP / TCP 192.168.1.19:502 > 192.168.1.23:49173 PA / Raw
Ether / IP / TCP 192.168.1.19:502 > 192.168.1.23:49173 PA / Raw
Ether / IP / TCP 192.168.1.19:502 > 192.168.1.23:49173 A / Padding
Ether / IP / TCP 192.168.1.19:502 > 192.168.1.23:49173 PA / Raw
[ Target : Ether / IP / TCP 192.168.1.19:502 > 192.168.1.23:49173 PA / Raw ]
Ether / IP / TCP 192.168.1.19:502 > 192.168.1.23:49173 PA / Raw
Ether / IP / TCP 192.168.1.19:502 > 192.168.1.23:49173 A / Padding
Ether / IP / TCP 192.168.1.19:502 > 192.168.1.23:49173 PA / Raw
Ether / IP / TCP 192.168.1.19:502 > 192.168.1.23:49173 PA / Raw
[ Target : Ether / IP / TCP 192.168.1.19:502 > 192.168.1.23:49173 PA / Raw ]
Ether / IP / TCP 192.168.1.19:502 > 192.168.1.23:49173 A / Padding
Ether / IP / TCP 192.168.1.19:502 > 192.168.1.23:49173 PA / Raw
Ether / IP / TCP 192.168.1.19:502 > 192.168.1.23:49173 PA / Raw
Ether / IP / TCP 192.168.1.19:502 > 192.168.1.23:49173 A / Padding
Ether / IP / TCP 192.168.1.19:502 > 192.168.1.23:49173 PA / Raw
[ Target : Ether / IP / TCP 192.168.1.19:502 > 192.168.1.23:49173 PA / Raw ]
Ether / IP / TCP 192.168.1.19:502 > 192.168.1.23:49173 PA / Raw
Ether / IP / TCP 192.168.1.19:502 > 192.168.1.23:49173 A / Padding
Ether / IP / TCP 192.168.1.19:502 > 192.168.1.23:49173 PA / Raw
Ether / IP / TCP 192.168.1.19:502 > 192.168.1.23:49173 PA / Raw
[ Target : Ether / IP / TCP 192.168.1.19:502 > 192.168.1.23:49173 PA / Raw ]
Ether / IP / TCP 192.168.1.19:502 > 192.168.1.23:49173 A / Padding
Ether / IP / TCP 192.168.1.19:502 > 192.168.1.23:49173 PA / Raw
Ether / IP / TCP 192.168.1.19:502 > 192.168.1.23:49173 PA / Raw
Ether / IP / TCP 192.168.1.19:502 > 192.168.1.23:49173 A / Padding
Ether / IP / TCP 192.168.1.19:502 > 192.168.1.23:49173 PA / Raw
[ Target : Ether / IP / TCP 192.168.1.19:502 > 192.168.1.23:49173 PA / Raw ]
Ether / IP / TCP 192.168.1.19:502 > 192.168.1.23:49173 PA / Raw
Ether / IP / TCP 192.168.1.19:502 > 192.168.1.23:49173 A / Padding
Ether / IP / TCP 192.168.1.19:502 > 192.168.1.23:49173 PA / Raw
Ether / IP / TCP 192.168.1.19:502 > 192.168.1.23:49173 PA / Raw
[ Target : Ether / IP / TCP 192.168.1.19:502 > 192.168.1.23:49173 PA / Raw ]
Ether / IP / TCP 192.168.1.19:502 > 192.168.1.23:49173 A / Padding
Ether / IP / TCP 192.168.1.19:502 > 192.168.1.23:49173 PA / Raw
Ether / IP / TCP 192.168.1.19:502 > 192.168.1.23:49173 PA / Raw
Ether / IP / TCP 192.168.1.19:502 > 192.168.1.23:49173 A / Padding
Ether / IP / TCP 192.168.1.19:502 > 192.168.1.23:49173 PA / Raw
[ Target : Ether / IP / TCP 192.168.1.19:502 > 192.168.1.23:49173 PA / Raw ]
Ether / IP / TCP 192.168.1.19:502 > 192.168.1.23:49173 PA / Raw
Ether / IP / TCP 192.168.1.19:502 > 192.168.1.23:49173 A / Padding
Ether / IP / TCP 192.168.1.19:502 > 192.168.1.23:49173 PA / Raw
Ether / IP / TCP 192.168.1.19:502 > 192.168.1.23:49173 PA / Raw
[ Target : Ether / IP / TCP 192.168.1.19:502 > 192.168.1.23:49173 PA / Raw ]
Ether / IP / TCP 192.168.1.19:502 > 192.168.1.23:49173 A / Padding
Ether / IP / TCP 192.168.1.19:502 > 192.168.1.23:49173 PA / Raw
Ether / IP / TCP 192.168.1.19:502 > 192.168.1.23:49173 PA / Raw
Ether / IP / TCP 192.168.1.19:502 > 192.168.1.23:49173 A / Padding
Ether / IP / TCP 192.168.1.19:502 > 192.168.1.23:49173 PA / Raw
[ Target : Ether / IP / TCP 192.168.1.19:502 > 192.168.1.23:49173 PA / Raw ]
Ether / IP / TCP 192.168.1.19:502 > 192.168.1.23:49173 PA / Raw
Ether / IP / TCP 192.168.1.19:502 > 192.168.1.23:49173 A / Padding
Ether / IP / TCP 192.168.1.19:502 > 192.168.1.23:49173 PA / Raw
Ether / IP / TCP 192.168.1.19:502 > 192.168.1.23:49173 PA / Raw
[ Target : Ether / IP / TCP 192.168.1.19:502 > 192.168.1.23:49173 PA / Raw ]
Ether / IP / TCP 192.168.1.19:502 > 192.168.1.23:49173 A / Padding
Ether / IP / TCP 192.168.1.19:502 > 192.168.1.23:49173 PA / Raw
Ether / IP / TCP 192.168.1.19:502 > 192.168.1.23:49173 PA / Raw
Ether / IP / TCP 192.168.1.19:502 > 192.168.1.23:49173 A / Padding
Ether / IP / TCP 192.168.1.19:502 > 192.168.1.23:49173 PA / Raw
[ Target : Ether / IP / TCP 192.168.1.19:502 > 192.168.1.23:49173 PA / Raw ]
Ether / IP / TCP 192.168.1.19:502 > 192.168.1.23:49173 PA / Raw
Ether / IP / TCP 192.168.1.19:502 > 192.168.1.23:49173 A / Padding
Ether / IP / TCP 192.168.1.19:502 > 192.168.1.23:49173 PA / Raw
Ether / IP / TCP 192.168.1.19:502 > 192.168.1.23:49173 PA / Raw
[ Target : Ether / IP / TCP 192.168.1.19:502 > 192.168.1.23:49173 PA / Raw ]
Ether / IP / TCP 192.168.1.19:502 > 192.168.1.23:49173 A / Padding
Ether / IP / TCP 192.168.1.19:502 > 192.168.1.23:49173 PA / Raw
Ether / IP / TCP 192.168.1.19:502 > 192.168.1.23:49173 PA / Raw
Ether / IP / TCP 192.168.1.19:502 > 192.168.1.23:49173 A / Padding
Ether / IP / TCP 192.168.1.19:502 > 192.168.1.23:49173 PA / Raw
[ Target : Ether / IP / TCP 192.168.1.19:502 > 192.168.1.23:49173 PA / Raw ]
Ether / IP / TCP 192.168.1.19:502 > 192.168.1.23:49173 PA / Raw
Ether / IP / TCP 192.168.1.19:502 > 192.168.1.23:49173 A / Padding
Ether / IP / TCP 192.168.1.19:502 > 192.168.1.23:49173 PA / Raw
Ether / IP / TCP 192.168.1.19:502 > 192.168.1.23:49173 PA / Raw
[ Target : Ether / IP / TCP 192.168.1.19:502 > 192.168.1.23:49173 PA / Raw ]
Ether / IP / TCP 192.168.1.19:502 > 192.168.1.23:49173 A / Padding
Ether / IP / TCP 192.168.1.19:502 > 192.168.1.23:49173 PA / Raw
Ether / IP / TCP 192.168.1.19:502 > 192.168.1.23:49173 PA / Raw
Ether / IP / TCP 192.168.1.19:502 > 192.168.1.23:49173 A / Padding
Ether / IP / TCP 192.168.1.19:502 > 192.168.1.23:49173 PA / Raw
[ Target : Ether / IP / TCP 192.168.1.19:502 > 192.168.1.23:49173 PA / Raw ]
Ether / IP / TCP 192.168.1.19:502 > 192.168.1.23:49173 PA / Raw
Ether / IP / TCP 192.168.1.19:502 > 192.168.1.23:49173 A / Padding
Ether / IP / TCP 192.168.1.19:502 > 192.168.1.23:49173 PA / Raw
Ether / IP / TCP 192.168.1.19:502 > 192.168.1.23:49173 PA / Raw
[ Target : Ether / IP / TCP 192.168.1.19:502 > 192.168.1.23:49173 PA / Raw ]
Ether / IP / TCP 192.168.1.19:502 > 192.168.1.23:49173 A / Padding
Ether / IP / TCP 192.168.1.19:502 > 192.168.1.23:49173 PA / Raw
Ether / IP / TCP 192.168.1.19:502 > 192.168.1.23:49173 PA / Raw
Ether / IP / TCP 192.168.1.19:502 > 192.168.1.23:49173 A / Padding
Ether / IP / TCP 192.168.1.19:502 > 192.168.1.23:49173 PA / Raw
[ Target : Ether / IP / TCP 192.168.1.19:502 > 192.168.1.23:49173 PA / Raw ]
Ether / IP / TCP 192.168.1.19:502 > 192.168.1.23:49173 PA / Raw
Ether / IP / TCP 192.168.1.19:502 > 192.168.1.23:49173 A / Padding
Ether / IP / TCP 192.168.1.19:502 > 192.168.1.23:49173 PA / Raw
Ether / IP / TCP 192.168.1.19:502 > 192.168.1.23:49173 PA / Raw
[ Target : Ether / IP / TCP 192.168.1.19:502 > 192.168.1.23:49173 PA / Raw ]
Ether / IP / TCP 192.168.1.19:502 > 192.168.1.23:49173 A / Padding
Ether / IP / TCP 192.168.1.19:502 > 192.168.1.23:49173 PA / Raw
Ether / IP / TCP 192.168.1.19:502 > 192.168.1.23:49173 PA / Raw
Ether / IP / TCP 192.168.1.19:502 > 192.168.1.23:49173 A / Padding
Ether / IP / TCP 192.168.1.19:502 > 192.168.1.23:49173 PA / Raw
[ Target : Ether / IP / TCP 192.168.1.19:502 > 192.168.1.23:49173 PA / Raw ]
Ether / IP / TCP 192.168.1.19:502 > 192.168.1.23:49173 PA / Raw
Ether / IP / TCP 192.168.1.19:502 > 192.168.1.23:49173 A / Padding
Ether / IP / TCP 192.168.1.19:502 > 192.168.1.23:49173 PA / Raw
Ether / IP / TCP 192.168.1.19:502 > 192.168.1.23:49173 PA / Raw
[ Target : Ether / IP / TCP 192.168.1.19:502 > 192.168.1.23:49173 PA / Raw ]
Ether / IP / TCP 192.168.1.19:502 > 192.168.1.23:49173 A / Padding
Ether / IP / TCP 192.168.1.19:502 > 192.168.1.23:49173 PA / Raw
Ether / IP / TCP 192.168.1.19:502 > 192.168.1.23:49173 PA / Raw
Ether / IP / TCP 192.168.1.19:502 > 192.168.1.23:49173 A / Padding
Ether / IP / TCP 192.168.1.19:502 > 192.168.1.23:49173 PA / Raw
[ Target : Ether / IP / TCP 192.168.1.19:502 > 192.168.1.23:49173 PA / Raw ]
Ether / IP / TCP 192.168.1.19:502 > 192.168.1.23:49173 PA / Raw
Ether / IP / TCP 192.168.1.19:502 > 192.168.1.23:49173 A / Padding
Ether / IP / TCP 192.168.1.19:502 > 192.168.1.23:49173 PA / Raw
Ether / IP / TCP 192.168.1.19:502 > 192.168.1.23:49173 PA / Raw
[ Target : Ether / IP / TCP 192.168.1.19:502 > 192.168.1.23:49173 PA / Raw ]
Ether / IP / TCP 192.168.1.19:502 > 192.168.1.23:49173 A / Padding
Ether / IP / TCP 192.168.1.19:502 > 192.168.1.23:49173 PA / Raw
Ether / IP / TCP 192.168.1.19:502 > 192.168.1.23:49173 PA / Raw
Ether / IP / TCP 192.168.1.19:502 > 192.168.1.23:49173 A / Padding
Ether / IP / TCP 192.168.1.19:502 > 192.168.1.23:49173 PA / Raw
[ Target : Ether / IP / TCP 192.168.1.19:502 > 192.168.1.23:49173 PA / Raw ]
Ether / IP / TCP 192.168.1.19:502 > 192.168.1.23:49173 PA / Raw
Ether / IP / TCP 192.168.1.19:502 > 192.168.1.23:49173 A / Padding
Ether / IP / TCP 192.168.1.19:502 > 192.168.1.23:49173 PA / Raw
Ether / IP / TCP 192.168.1.19:502 > 192.168.1.23:49173 PA / Raw
[ Target : Ether / IP / TCP 192.168.1.19:502 > 192.168.1.23:49173 PA / Raw ]
Ether / IP / TCP 192.168.1.19:502 > 192.168.1.23:49173 A / Padding
Ether / IP / TCP 192.168.1.19:502 > 192.168.1.23:49173 PA / Raw
Ether / IP / TCP 192.168.1.19:502 > 192.168.1.23:49173 PA / Raw
Ether / IP / TCP 192.168.1.19:502 > 192.168.1.23:49173 A / Padding
Ether / IP / TCP 192.168.1.19:502 > 192.168.1.23:49173 PA / Raw
[ Target : Ether / IP / TCP 192.168.1.19:502 > 192.168.1.23:49173 PA / Raw ]
Ether / IP / TCP 192.168.1.19:502 > 192.168.1.23:49173 PA / Raw
Ether / IP / TCP 192.168.1.19:502 > 192.168.1.23:49173 A / Padding
Ether / IP / TCP 192.168.1.19:502 > 192.168.1.23:49173 PA / Raw
Ether / IP / TCP 192.168.1.19:502 > 192.168.1.23:49173 PA / Raw
[ Target : Ether / IP / TCP 192.168.1.19:502 > 192.168.1.23:49173 PA / Raw ]
Ether / IP / TCP 192.168.1.19:502 > 192.168.1.23:49173 A / Padding
Ether / IP / TCP 192.168.1.19:502 > 192.168.1.23:49173 PA / Raw
Ether / IP / TCP 192.168.1.19:502 > 192.168.1.23:49173 PA / Raw
Ether / IP / TCP 192.168.1.19:502 > 192.168.1.23:49173 A / Padding
Ether / IP / TCP 192.168.1.19:502 > 192.168.1.23:49173 PA / Raw
[ Target : Ether / IP / TCP 192.168.1.19:502 > 192.168.1.23:49173 PA / Raw ]
Ether / IP / TCP 192.168.1.19:502 > 192.168.1.23:49173 PA / Raw
Ether / IP / TCP 192.168.1.19:502 > 192.168.1.23:49173 A / Padding
Ether / IP / TCP 192.168.1.19:502 > 192.168.1.23:49173 PA / Raw
Ether / IP / TCP 192.168.1.19:502 > 192.168.1.23:49173 PA / Raw
[ Target : Ether / IP / TCP 192.168.1.19:502 > 192.168.1.23:49173 PA / Raw ]
Ether / IP / TCP 192.168.1.19:502 > 192.168.1.23:49173 A / Padding
Ether / IP / TCP 192.168.1.19:502 > 192.168.1.23:49173 PA / Raw
Ether / IP / TCP 192.168.1.19:502 > 192.168.1.23:49173 PA / Raw
Ether / IP / TCP 192.168.1.19:502 > 192.168.1.23:49173 A / Padding
Ether / IP / TCP 192.168.1.19:502 > 192.168.1.23:49173 PA / Raw
[ Target : Ether / IP / TCP 192.168.1.19:502 > 192.168.1.23:49173 PA / Raw ]
Ether / IP / TCP 192.168.1.19:502 > 192.168.1.23:49173 PA / Raw
Ether / IP / TCP 192.168.1.19:502 > 192.168.1.23:49173 A / Padding
Ether / IP / TCP 192.168.1.19:502 > 192.168.1.23:49173 PA / Raw
Ether / IP / TCP 192.168.1.19:502 > 192.168.1.23:49173 PA / Raw
[ Target : Ether / IP / TCP 192.168.1.19:502 > 192.168.1.23:49173 PA / Raw ]
Ether / IP / TCP 192.168.1.19:502 > 192.168.1.23:49173 A / Padding
Ether / IP / TCP 192.168.1.19:502 > 192.168.1.23:49173 PA / Raw
Ether / IP / TCP 192.168.1.19:502 > 192.168.1.23:49173 PA / Raw
Ether / IP / TCP 192.168.1.19:502 > 192.168.1.23:49173 A / Padding
Ether / IP / TCP 192.168.1.19:502 > 192.168.1.23:49173 PA / Raw
Ether / IP / TCP 192.168.1.19:502 > 192.168.1.23:49173 PA / Raw
[ Target : Ether / IP / TCP 192.168.1.19:502 > 192.168.1.23:49173 PA / Raw ]
Ether / IP / TCP 192.168.1.19:502 > 192.168.1.23:49173 A / Padding
Ether / IP / TCP 192.168.1.19:502 > 192.168.1.23:49173 PA / Raw
Ether / IP / TCP 192.168.1.19:502 > 192.168.1.23:49173 PA / Raw
Ether / IP / TCP 192.168.1.19:502 > 192.168.1.23:49173 A / Padding
Ether / IP / TCP 192.168.1.19:502 > 192.168.1.23:49173 PA / Raw
[ Target : Ether / IP / TCP 192.168.1.19:502 > 192.168.1.23:49173 PA / Raw ]
Ether / IP / TCP 192.168.1.19:502 > 192.168.1.23:49173 PA / Raw
Ether / IP / TCP 192.168.1.19:502 > 192.168.1.23:49173 A / Padding
Ether / IP / TCP 192.168.1.19:502 > 192.168.1.23:49173 PA / Raw
Ether / IP / TCP 192.168.1.19:502 > 192.168.1.23:49173 PA / Raw
[ Target : Ether / IP / TCP 192.168.1.19:502 > 192.168.1.23:49173 PA / Raw ]
Ether / IP / TCP 192.168.1.19:502 > 192.168.1.23:49173 A / Padding
Ether / IP / TCP 192.168.1.19:502 > 192.168.1.23:49173 PA / Raw
Ether / IP / TCP 192.168.1.19:502 > 192.168.1.23:49173 PA / Raw
Ether / IP / TCP 192.168.1.19:502 > 192.168.1.23:49173 A / Padding
Ether / IP / TCP 192.168.1.19:502 > 192.168.1.23:49173 PA / Raw
[ Target : Ether / IP / TCP 192.168.1.19:502 > 192.168.1.23:49173 PA / Raw ]
Ether / IP / TCP 192.168.1.19:502 > 192.168.1.23:49173 PA / Raw
Ether / IP / TCP 192.168.1.19:502 > 192.168.1.23:49173 A / Padding
Ether / IP / TCP 192.168.1.19:502 > 192.168.1.23:49173 PA / Raw
Ether / IP / TCP 192.168.1.19:502 > 192.168.1.23:49173 PA / Raw
[ Target : Ether / IP / TCP 192.168.1.19:502 > 192.168.1.23:49173 PA / Raw ]
Ether / IP / TCP 192.168.1.19:502 > 192.168.1.23:49173 A / Padding
Ether / IP / TCP 192.168.1.19:502 > 192.168.1.23:49173 PA / Raw
Ether / IP / TCP 192.168.1.19:502 > 192.168.1.23:49173 PA / Raw
Ether / IP / TCP 192.168.1.19:502 > 192.168.1.23:49173 A / Padding
Ether / IP / TCP 192.168.1.19:502 > 192.168.1.23:49173 PA / Raw
[ Target : Ether / IP / TCP 192.168.1.19:502 > 192.168.1.23:49173 PA / Raw ]
Ether / IP / TCP 192.168.1.19:502 > 192.168.1.23:49173 PA / Raw
Ether / IP / TCP 192.168.1.19:502 > 192.168.1.23:49173 A / Padding
Ether / IP / TCP 192.168.1.19:502 > 192.168.1.23:49173 PA / Raw
Ether / IP / TCP 192.168.1.19:502 > 192.168.1.23:49173 PA / Raw
[ Target : Ether / IP / TCP 192.168.1.19:502 > 192.168.1.23:49173 PA / Raw ]
Ether / IP / TCP 192.168.1.19:502 > 192.168.1.23:49173 A / Padding
Ether / IP / TCP 192.168.1.19:502 > 192.168.1.23:49173 PA / Raw
Ether / IP / TCP 192.168.1.19:502 > 192.168.1.23:49173 PA / Raw
Ether / IP / TCP 192.168.1.19:502 > 192.168.1.23:49173 A / Padding
Ether / IP / TCP 192.168.1.19:502 > 192.168.1.23:49173 PA / Raw
[ Target : Ether / IP / TCP 192.168.1.19:502 > 192.168.1.23:49173 PA / Raw ]
Ether / IP / TCP 192.168.1.19:502 > 192.168.1.23:49173 PA / Raw
Ether / IP / TCP 192.168.1.19:502 > 192.168.1.23:49173 A / Padding
Ether / IP / TCP 192.168.1.19:502 > 192.168.1.23:49173 PA / Raw
Ether / IP / TCP 192.168.1.19:502 > 192.168.1.23:49173 PA / Raw
[ Target : Ether / IP / TCP 192.168.1.19:502 > 192.168.1.23:49173 PA / Raw ]
Ether / IP / TCP 192.168.1.19:502 > 192.168.1.23:49173 A / Padding
Ether / IP / TCP 192.168.1.19:502 > 192.168.1.23:49173 PA / Raw
Ether / IP / TCP 192.168.1.19:502 > 192.168.1.23:49173 PA / Raw
Ether / IP / TCP 192.168.1.19:502 > 192.168.1.23:49173 A / Padding
Ether / IP / TCP 192.168.1.19:502 > 192.168.1.23:49173 PA / Raw
[ Target : Ether / IP / TCP 192.168.1.19:502 > 192.168.1.23:49173 PA / Raw ]
Ether / IP / TCP 192.168.1.19:502 > 192.168.1.23:49173 PA / Raw
Ether / IP / TCP 192.168.1.19:502 > 192.168.1.23:49173 A / Padding
Ether / IP / TCP 192.168.1.19:502 > 192.168.1.23:49173 PA / Raw
Ether / IP / TCP 192.168.1.19:502 > 192.168.1.23:49173 PA / Raw
[ Target : Ether / IP / TCP 192.168.1.19:502 > 192.168.1.23:49173 PA / Raw ]
Ether / IP / TCP 192.168.1.19:502 > 192.168.1.23:49173 A / Padding
Ether / IP / TCP 192.168.1.19:502 > 192.168.1.23:49173 PA / Raw
Ether / IP / TCP 192.168.1.19:502 > 192.168.1.23:49173 PA / Raw
Ether / IP / TCP 192.168.1.19:502 > 192.168.1.23:49173 A / Padding
Ether / IP / TCP 192.168.1.19:502 > 192.168.1.23:49173 PA / Raw
[ Target : Ether / IP / TCP 192.168.1.19:502 > 192.168.1.23:49173 PA / Raw ]
Ether / IP / TCP 192.168.1.19:502 > 192.168.1.23:49173 PA / Raw
Ether / IP / TCP 192.168.1.19:502 > 192.168.1.23:49173 A / Padding
Ether / IP / TCP 192.168.1.19:502 > 192.168.1.23:49173 PA / Raw
Ether / IP / TCP 192.168.1.19:502 > 192.168.1.23:49173 PA / Raw
[ Target : Ether / IP / TCP 192.168.1.19:502 > 192.168.1.23:49173 PA / Raw ]
Ether / IP / TCP 192.168.1.19:502 > 192.168.1.23:49173 A / Padding
Ether / IP / TCP 192.168.1.19:502 > 192.168.1.23:49173 PA / Raw
Ether / IP / TCP 192.168.1.19:502 > 192.168.1.23:49173 PA / Raw
Ether / IP / TCP 192.168.1.19:502 > 192.168.1.23:49173 A / Padding
Ether / IP / TCP 192.168.1.19:502 > 192.168.1.23:49173 PA / Raw
[ Target : Ether / IP / TCP 192.168.1.19:502 > 192.168.1.23:49173 PA / Raw ]
Ether / IP / TCP 192.168.1.19:502 > 192.168.1.23:49173 PA / Raw
Ether / IP / TCP 192.168.1.19:502 > 192.168.1.23:49173 A / Padding
Ether / IP / TCP 192.168.1.19:502 > 192.168.1.23:49173 PA / Raw
Ether / IP / TCP 192.168.1.19:502 > 192.168.1.23:49173 PA / Raw
[ Target : Ether / IP / TCP 192.168.1.19:502 > 192.168.1.23:49173 PA / Raw ]
Ether / IP / TCP 192.168.1.19:502 > 192.168.1.23:49173 A / Padding
Ether / IP / TCP 192.168.1.19:502 > 192.168.1.23:49173 PA / Raw
Ether / IP / TCP 192.168.1.19:502 > 192.168.1.23:49173 PA / Raw
Ether / IP / TCP 192.168.1.19:502 > 192.168.1.23:49173 A / Padding
Ether / IP / TCP 192.168.1.19:502 > 192.168.1.23:49173 PA / Raw
[ Target : Ether / IP / TCP 192.168.1.19:502 > 192.168.1.23:49173 PA / Raw ]
Ether / IP / TCP 192.168.1.19:502 > 192.168.1.23:49173 PA / Raw
Ether / IP / TCP 192.168.1.19:502 > 192.168.1.23:49173 A / Padding
Ether / IP / TCP 192.168.1.19:502 > 192.168.1.23:49173 PA / Raw
Ether / IP / TCP 192.168.1.19:502 > 192.168.1.23:49173 PA / Raw
[ Target : Ether / IP / TCP 192.168.1.19:502 > 192.168.1.23:49173 PA / Raw ]
Ether / IP / TCP 192.168.1.19:502 > 192.168.1.23:49173 A / Padding
Ether / IP / TCP 192.168.1.19:502 > 192.168.1.23:49173 PA / Raw
Ether / IP / TCP 192.168.1.19:502 > 192.168.1.23:49173 PA / Raw
Ether / IP / TCP 192.168.1.19:502 > 192.168.1.23:49173 A / Padding
Ether / IP / TCP 192.168.1.19:502 > 192.168.1.23:49173 PA / Raw
[ Target : Ether / IP / TCP 192.168.1.19:502 > 192.168.1.23:49173 PA / Raw ]
Ether / IP / TCP 192.168.1.19:502 > 192.168.1.23:49173 PA / Raw
Ether / IP / TCP 192.168.1.19:502 > 192.168.1.23:49173 A / Padding
Ether / IP / TCP 192.168.1.19:502 > 192.168.1.23:49173 PA / Raw
Ether / IP / TCP 192.168.1.19:502 > 192.168.1.23:49173 PA / Raw
[ Target : Ether / IP / TCP 192.168.1.19:502 > 192.168.1.23:49173 PA / Raw ]
Ether / IP / TCP 192.168.1.19:502 > 192.168.1.23:49173 A / Padding
Ether / IP / TCP 192.168.1.19:502 > 192.168.1.23:49173 PA / Raw
Ether / IP / TCP 192.168.1.19:502 > 192.168.1.23:49173 PA / Raw
Ether / IP / TCP 192.168.1.19:502 > 192.168.1.23:49173 A / Padding
Ether / IP / TCP 192.168.1.19:502 > 192.168.1.23:49173 PA / Raw
[ Target : Ether / IP / TCP 192.168.1.19:502 > 192.168.1.23:49173 PA / Raw ]
Ether / IP / TCP 192.168.1.19:502 > 192.168.1.23:49173 PA / Raw
Ether / IP / TCP 192.168.1.19:502 > 192.168.1.23:49173 A / Padding
Ether / IP / TCP 192.168.1.19:502 > 192.168.1.23:49173 PA / Raw
Ether / IP / TCP 192.168.1.19:502 > 192.168.1.23:49173 PA / Raw
[ Target : Ether / IP / TCP 192.168.1.19:502 > 192.168.1.23:49173 PA / Raw ]
Ether / IP / TCP 192.168.1.19:502 > 192.168.1.23:49173 A / Padding
Ether / IP / TCP 192.168.1.19:502 > 192.168.1.23:49173 PA / Raw
Ether / IP / TCP 192.168.1.19:502 > 192.168.1.23:49173 PA / Raw
Ether / IP / TCP 192.168.1.19:502 > 192.168.1.23:49173 A / Padding
Ether / IP / TCP 192.168.1.19:502 > 192.168.1.23:49173 PA / Raw
[ Target : Ether / IP / TCP 192.168.1.19:502 > 192.168.1.23:49173 PA / Raw ]
Ether / IP / TCP 192.168.1.19:502 > 192.168.1.23:49173 PA / Raw
Ether / IP / TCP 192.168.1.19:502 > 192.168.1.23:49173 A / Padding
Ether / IP / TCP 192.168.1.19:502 > 192.168.1.23:49173 PA / Raw
Ether / IP / TCP 192.168.1.19:502 > 192.168.1.23:49173 PA / Raw
[ Target : Ether / IP / TCP 192.168.1.19:502 > 192.168.1.23:49173 PA / Raw ]
Ether / IP / TCP 192.168.1.19:502 > 192.168.1.23:49173 A / Padding
Ether / IP / TCP 192.168.1.19:502 > 192.168.1.23:49173 PA / Raw
Ether / IP / TCP 192.168.1.19:502 > 192.168.1.23:49173 PA / Raw
Ether / IP / TCP 192.168.1.19:502 > 192.168.1.23:49173 A / Padding
Ether / IP / TCP 192.168.1.19:502 > 192.168.1.23:49173 PA / Raw
[ Target : Ether / IP / TCP 192.168.1.19:502 > 192.168.1.23:49173 PA / Raw ]
Ether / IP / TCP 192.168.1.19:502 > 192.168.1.23:49173 PA / Raw
Ether / IP / TCP 192.168.1.19:502 > 192.168.1.23:49173 A / Padding
Ether / IP / TCP 192.168.1.19:502 > 192.168.1.23:49173 PA / Raw
Ether / IP / TCP 192.168.1.19:502 > 192.168.1.23:49173 PA / Raw
[ Target : Ether / IP / TCP 192.168.1.19:502 > 192.168.1.23:49173 PA / Raw ]
Ether / IP / TCP 192.168.1.19:502 > 192.168.1.23:49173 A / Padding
Ether / IP / TCP 192.168.1.19:502 > 192.168.1.23:49173 PA / Raw
Ether / IP / TCP 192.168.1.19:502 > 192.168.1.23:49173 PA / Raw
Ether / IP / TCP 192.168.1.19:502 > 192.168.1.23:49173 A / Padding
Ether / IP / TCP 192.168.1.19:502 > 192.168.1.23:49173 PA / Raw
[ Target : Ether / IP / TCP 192.168.1.19:502 > 192.168.1.23:49173 PA / Raw ]
Ether / IP / TCP 192.168.1.19:502 > 192.168.1.23:49173 PA / Raw
Ether / IP / TCP 192.168.1.19:502 > 192.168.1.23:49173 A / Padding
Ether / IP / TCP 192.168.1.19:502 > 192.168.1.23:49173 PA / Raw
Ether / IP / TCP 192.168.1.19:502 > 192.168.1.23:49173 PA / Raw
[ Target : Ether / IP / TCP 192.168.1.19:502 > 192.168.1.23:49173 PA / Raw ]
Ether / IP / TCP 192.168.1.19:502 > 192.168.1.23:49173 A / Padding
Ether / IP / TCP 192.168.1.19:502 > 192.168.1.23:49173 PA / Raw
Ether / IP / TCP 192.168.1.19:502 > 192.168.1.23:49173 PA / Raw
Ether / IP / TCP 192.168.1.19:502 > 192.168.1.23:49173 A / Padding
Ether / IP / TCP 192.168.1.19:502 > 192.168.1.23:49173 PA / Raw
[ Target : Ether / IP / TCP 192.168.1.19:502 > 192.168.1.23:49173 PA / Raw ]
Ether / IP / TCP 192.168.1.19:502 > 192.168.1.23:49173 PA / Raw
Ether / IP / TCP 192.168.1.19:502 > 192.168.1.23:49173 A / Padding
Ether / IP / TCP 192.168.1.19:502 > 192.168.1.23:49173 PA / Raw
Ether / IP / TCP 192.168.1.19:502 > 192.168.1.23:49173 PA / Raw
[ Target : Ether / IP / TCP 192.168.1.19:502 > 192.168.1.23:49173 PA / Raw ]
Ether / IP / TCP 192.168.1.19:502 > 192.168.1.23:49173 A / Padding
Ether / IP / TCP 192.168.1.19:502 > 192.168.1.23:49173 PA / Raw
Ether / IP / TCP 192.168.1.19:502 > 192.168.1.23:49173 PA / Raw
Ether / IP / TCP 192.168.1.19:502 > 192.168.1.23:49173 A / Padding
Ether / IP / TCP 192.168.1.19:502 > 192.168.1.23:49173 PA / Raw
[ Target : Ether / IP / TCP 192.168.1.19:502 > 192.168.1.23:49173 PA / Raw ]
Ether / IP / TCP 192.168.1.19:502 > 192.168.1.23:49173 PA / Raw
Ether / IP / TCP 192.168.1.19:502 > 192.168.1.23:49173 A / Padding
Ether / IP / TCP 192.168.1.19:502 > 192.168.1.23:49173 PA / Raw
Ether / IP / TCP 192.168.1.19:502 > 192.168.1.23:49173 PA / Raw
[ Target : Ether / IP / TCP 192.168.1.19:502 > 192.168.1.23:49173 PA / Raw ]
Ether / IP / TCP 192.168.1.19:502 > 192.168.1.23:49173 A / Padding
Ether / IP / TCP 192.168.1.19:502 > 192.168.1.23:49173 PA / Raw
Ether / IP / TCP 192.168.1.19:502 > 192.168.1.23:49173 PA / Raw
Ether / IP / TCP 192.168.1.19:502 > 192.168.1.23:49173 A / Padding
Ether / IP / TCP 192.168.1.19:502 > 192.168.1.23:49173 PA / Raw
[ Target : Ether / IP / TCP 192.168.1.19:502 > 192.168.1.23:49173 PA / Raw ]
Ether / IP / TCP 192.168.1.19:502 > 192.168.1.23:49173 PA / Raw
